{
  "kind": "scip-query-obligation-admission",
  "schemaVersion": 1,
  "obligationId": "SQO-CCD70AC846F030842DF958F747606B1A",
  "collaborationDomainId": "5ea57d1a-936c-4c91-b58f-5d61e45173a5",
  "changeId": "SQC-1A2415329C13102CED863257667AA0DE",
  "category": "architecture",
  "title": "Preserve architecture: architecture",
  "requiredCondition": "The configured architecture policy remains clean",
  "source": {
    "kind": "agent-discovery",
    "referent": "SQP-BB1236038C8CB62F2720A7ACC8BF3CC6#architecture:architecture"
  },
  "basisAttemptIds": [],
  "evidenceReceipts": [
    {
      "schemaVersion": 2,
      "observedAt": "2026-08-02T00:16:32.383Z",
      "facts": {
        "collaborationDomain": {
          "schemaVersion": 1,
          "canonicalizationVersion": 1,
          "hashAlgorithm": "sha256",
          "projection": {
            "name": "scip-query:collaboration-domain",
            "version": 1
          },
          "digest": "65fa7070a947c694f38de6708f2444d2bc2642785dcdb898d24a0401b41fb3c3"
        },
        "workspaceInstance": {
          "schemaVersion": 1,
          "canonicalizationVersion": 1,
          "hashAlgorithm": "sha256",
          "projection": {
            "name": "scip-query:workspace-instance",
            "version": 1
          },
          "digest": "f53b738aebdbca65df7f5d79a4bfc01cb854528c2a00705171682a625937c0c4"
        },
        "wholeContent": {
          "schemaVersion": 1,
          "canonicalizationVersion": 1,
          "hashAlgorithm": "sha256",
          "projection": {
            "name": "scip-query:repository-content",
            "version": 1
          },
          "digest": "cd78e9432c640b00100027acb3ade3babbb142b73b4edb2cbde906fef29479f3"
        },
        "relevantInputs": [
          {
            "subject": "scip-query:index-inputs",
            "identity": {
              "schemaVersion": 1,
              "canonicalizationVersion": 1,
              "hashAlgorithm": "sha256",
              "projection": {
                "name": "scip-query:index-inputs",
                "version": 2
              },
              "digest": "008a80b60492ab5f778ec217459fd4928e04cafb9f7f1e7a9359247ea74605b3"
            }
          }
        ]
      },
      "observedSources": [
        {
          "kind": "repository-snapshot",
          "identity": {
            "schemaVersion": 1,
            "canonicalizationVersion": 1,
            "hashAlgorithm": "sha256",
            "projection": {
              "name": "scip-query:repository-content",
              "version": 1
            },
            "digest": "cd78e9432c640b00100027acb3ade3babbb142b73b4edb2cbde906fef29479f3"
          }
        }
      ],
      "stabilityProofs": [
        {
          "source": "repository-snapshot",
          "kind": "fixed-snapshot"
        }
      ],
      "diagnostics": {
        "clean": false,
        "headCommit": "075e6d93bd8690a7433bceadc6582b1ad09daf8a",
        "treeOid": "dafd1a959b789e44b6caa38bea85f157ae4b0491"
      }
    }
  ],
  "idempotency": {
    "version": 1,
    "algorithm": "sha256",
    "keyDigest": "ccd70ac846f030842df958f747606b1a1bfc9e7e4bd6eca5ab626fe24201ab90",
    "requestDigest": "9567cc3207a37d0fd6ae116da1e6bfa1a2019b1f1fd91a9acce9044058331c31"
  },
  "createdAt": "2026-08-02T00:16:32.384Z",
  "writer": {
    "tool": "scip-query",
    "version": "0.20.0"
  }
}
